<?xml version="1.0" encoding="UTF-8"?>
<rapport_data xmlns:xsi="http://www.w3.org/2001/XMLSchema-instance"
              xsi:noNamespaceSchemaLocation="rapport_schema.xsd">

  <row>
    <date_rapport></date_rapport>
    <appellation_produit></appellation_produit>
    <nom_entreprise_client></nom_entreprise_client>
    <adresse_entreprise_client></adresse_entreprise_client>
    <nom_destinataire></nom_destinataire>
    <titre_poste_destinataire></titre_poste_destinataire>

    <Lieu_de_prelevment></Lieu_de_prelevment>
    <date_heure_prelevment></date_heure_prelevment>
    <adresse_prelevement></adresse_prelevement>
    <ville_prelevement></ville_prelevement>
    <conditions_coservation_reception></conditions_coservation_reception>
    <date_heure_arrive_labo></date_heure_arrive_labo>
    <temperature_reception></temperature_reception>
    <date_heure_mise_en_analyse></date_heure_mise_en_analyse>

    <fournisseur_fabricant></fournisseur_fabricant>
    <nom_produit></nom_produit>
    <conditionnement></conditionnement>
    <espece></espece>
    <agrement></agrement>
    <origine></origine>
    <lot></lot>
    <date_emabalage></date_emabalage>
    <code_article></code_article>
    <dlc></dlc>

    <lot_precice></lot_precice>
    <imp></imp>
    <k_value></k_value>

    <conformite></conformite>
    <qualite></qualite>

    <date_du_jour></date_du_jour>
    <report_number></report_number>
    <numero_rapport></numero_rapport>
    <file_name></file_name>
  </row>

</rapport_data>
